{
  "schemaVersion": 1,
  "projectId": "thermochemistry-example",
  "jobId": "cea-example-8",
  "inputRevision": 1,
  "reactants": [
    {
      "species": "H2(L)",
      "massFraction": 0.15263516989057585,
      "temperatureK": 20.27
    },
    {
      "species": "O2(L)",
      "massFraction": 0.8473648301094242,
      "temperatureK": 90.17
    }
  ],
  "calculation": {
    "type": "rocket",
    "chamberPressurePa": 5331720.0,
    "exitAreaRatios": [
      25.0,
      50.0,
      75.0
    ],
    "chemistry": "equilibrium"
  }
}
